<?xml version="1.0" encoding="UTF-8"?>
<TileMatrixSet id="WorldCRS84Quad" xmlns="http://www.opengis.net/tms/2.0" xmlns:tmsc="http://www.opengis.net/tms/2.0/common" xmlns:xsi="http://www.w3.org/2001/XMLSchema-instance" xsi:schemaLocation="http://www.opengis.net/tms/2.0 ../../tilematrixset.xsd">
	<tmsc:Title>CRS84 for the World</tmsc:Title>
	<tmsc:Identifier>WorldCRS84Quad</tmsc:Identifier>
	<tmsc:BoundingBox crs="http://www.opengis.net/def/crs/OGC/1.3/CRS84">
		<tmsc:LowerCorner>-180 -90</tmsc:LowerCorner>
		<tmsc:UpperCorner>180 90</tmsc:UpperCorner>
	</tmsc:BoundingBox>
	<tmsc:SupportedCRS>
		<tmsc:URI>http://www.opengis.net/def/crs/OGC/1.3/CRS84</tmsc:URI>
	</tmsc:SupportedCRS>
	<WellKnownScaleSet>
            http://www.opengis.net/def/wkss/OGC/1.0/GoogleCRS84Quad
         </WellKnownScaleSet>
	<TileMatrix>
		<tmsc:Identifier>0</tmsc:Identifier>
		<ScaleDenominator>279541132.014358</ScaleDenominator>
		<CellSize>0.703125</CellSize>
		<PointOfOrigin>-180 90</PointOfOrigin>
		<TileWidth>256</TileWidth>
		<TileHeight>256</TileHeight>
		<MatrixWidth>2</MatrixWidth>
		<MatrixHeight>1</MatrixHeight>
	</TileMatrix>
	<TileMatrix>
		<tmsc:Identifier>1</tmsc:Identifier>
		<ScaleDenominator>139770566.007179</ScaleDenominator>
		<CellSize>0.3515625</CellSize>
		<PointOfOrigin>-180 90</PointOfOrigin>
		<TileWidth>256</TileWidth>
		<TileHeight>256</TileHeight>
		<MatrixWidth>4</MatrixWidth>
		<MatrixHeight>2</MatrixHeight>
	</TileMatrix>
	<TileMatrix>
		<tmsc:Identifier>2</tmsc:Identifier>
		<ScaleDenominator>69885283.0035897</ScaleDenominator>
		<CellSize>0.17578125</CellSize>
		<PointOfOrigin>-180 90</PointOfOrigin>
		<TileWidth>256</TileWidth>
		<TileHeight>256</TileHeight>
		<MatrixWidth>8</MatrixWidth>
		<MatrixHeight>4</MatrixHeight>
	</TileMatrix>
	<TileMatrix>
		<tmsc:Identifier>3</tmsc:Identifier>
		<ScaleDenominator>34942641.5017948</ScaleDenominator>
		<CellSize>0.087890625</CellSize>
		<PointOfOrigin>-180 90</PointOfOrigin>
		<TileWidth>256</TileWidth>
		<TileHeight>256</TileHeight>
		<MatrixWidth>16</MatrixWidth>
		<MatrixHeight>8</MatrixHeight>
	</TileMatrix>
	<TileMatrix>
		<tmsc:Identifier>4</tmsc:Identifier>
		<ScaleDenominator>17471320.7508974</ScaleDenominator>
		<CellSize>0.0439453125</CellSize>
		<PointOfOrigin>-180 90</PointOfOrigin>
		<TileWidth>256</TileWidth>
		<TileHeight>256</TileHeight>
		<MatrixWidth>32</MatrixWidth>
		<MatrixHeight>16</MatrixHeight>
	</TileMatrix>
	<TileMatrix>
		<tmsc:Identifier>5</tmsc:Identifier>
		<ScaleDenominator>8735660.37544871</ScaleDenominator>
		<CellSize>0.02197265625</CellSize>
		<PointOfOrigin>-180 90</PointOfOrigin>
		<TileWidth>256</TileWidth>
		<TileHeight>256</TileHeight>
		<MatrixWidth>64</MatrixWidth>
		<MatrixHeight>32</MatrixHeight>
	</TileMatrix>
	<TileMatrix>
		<tmsc:Identifier>6</tmsc:Identifier>
		<ScaleDenominator>4367830.18772435</ScaleDenominator>
		<CellSize>0.010986328125</CellSize>
		<PointOfOrigin>-180 90</PointOfOrigin>
		<TileWidth>256</TileWidth>
		<TileHeight>256</TileHeight>
		<MatrixWidth>128</MatrixWidth>
		<MatrixHeight>64</MatrixHeight>
	</TileMatrix>
	<TileMatrix>
		<tmsc:Identifier>7</tmsc:Identifier>
		<ScaleDenominator>2183915.09386217</ScaleDenominator>
		<CellSize>0.0054931640625</CellSize>
		<PointOfOrigin>-180 90</PointOfOrigin>
		<TileWidth>256</TileWidth>
		<TileHeight>256</TileHeight>
		<MatrixWidth>256</MatrixWidth>
		<MatrixHeight>128</MatrixHeight>
	</TileMatrix>
	<TileMatrix>
		<tmsc:Identifier>8</tmsc:Identifier>
		<ScaleDenominator>1091957.54693108</ScaleDenominator>
		<CellSize>0.00274658203125</CellSize>
		<PointOfOrigin>-180 90</PointOfOrigin>
		<TileWidth>256</TileWidth>
		<TileHeight>256</TileHeight>
		<MatrixWidth>512</MatrixWidth>
		<MatrixHeight>256</MatrixHeight>
	</TileMatrix>
	<TileMatrix>
		<tmsc:Identifier>9</tmsc:Identifier>
		<ScaleDenominator>545978.773465544</ScaleDenominator>
		<CellSize>0.001373291015625</CellSize>
		<PointOfOrigin>-180 90</PointOfOrigin>
		<TileWidth>256</TileWidth>
		<TileHeight>256</TileHeight>
		<MatrixWidth>1024</MatrixWidth>
		<MatrixHeight>512</MatrixHeight>
	</TileMatrix>
	<TileMatrix>
		<tmsc:Identifier>10</tmsc:Identifier>
		<ScaleDenominator>272989.386732772</ScaleDenominator>
		<CellSize>0.0006866455078125</CellSize>
		<PointOfOrigin>-180 90</PointOfOrigin>
		<TileWidth>256</TileWidth>
		<TileHeight>256</TileHeight>
		<MatrixWidth>2048</MatrixWidth>
		<MatrixHeight>1024</MatrixHeight>
	</TileMatrix>
	<TileMatrix>
		<tmsc:Identifier>11</tmsc:Identifier>
		<ScaleDenominator>136494.693366386</ScaleDenominator>
		<CellSize>0.00034332275390625</CellSize>
		<PointOfOrigin>-180 90</PointOfOrigin>
		<TileWidth>256</TileWidth>
		<TileHeight>256</TileHeight>
		<MatrixWidth>4096</MatrixWidth>
		<MatrixHeight>2048</MatrixHeight>
	</TileMatrix>
	<TileMatrix>
		<tmsc:Identifier>12</tmsc:Identifier>
		<ScaleDenominator>68247.346683193</ScaleDenominator>
		<CellSize>0.000171661376953125</CellSize>
		<PointOfOrigin>-180 90</PointOfOrigin>
		<TileWidth>256</TileWidth>
		<TileHeight>256</TileHeight>
		<MatrixWidth>8192</MatrixWidth>
		<MatrixHeight>4096</MatrixHeight>
	</TileMatrix>
	<TileMatrix>
		<tmsc:Identifier>13</tmsc:Identifier>
		<ScaleDenominator>34123.6733415964</ScaleDenominator>
		<CellSize>8.58306884765625E-05</CellSize>
		<PointOfOrigin>-180 90</PointOfOrigin>
		<TileWidth>256</TileWidth>
		<TileHeight>256</TileHeight>
		<MatrixWidth>16384</MatrixWidth>
		<MatrixHeight>8192</MatrixHeight>
	</TileMatrix>
	<TileMatrix>
		<tmsc:Identifier>14</tmsc:Identifier>
		<ScaleDenominator>17061.8366707982</ScaleDenominator>
		<CellSize>4.29153442382812E-05</CellSize>
		<PointOfOrigin>-180 90</PointOfOrigin>
		<TileWidth>256</TileWidth>
		<TileHeight>256</TileHeight>
		<MatrixWidth>32768</MatrixWidth>
		<MatrixHeight>16384</MatrixHeight>
	</TileMatrix>
	<TileMatrix>
		<tmsc:Identifier>15</tmsc:Identifier>
		<ScaleDenominator>8530.91833539913</ScaleDenominator>
		<CellSize>2.14576721191406E-05</CellSize>
		<PointOfOrigin>-180 90</PointOfOrigin>
		<TileWidth>256</TileWidth>
		<TileHeight>256</TileHeight>
		<MatrixWidth>65536</MatrixWidth>
		<MatrixHeight>32768</MatrixHeight>
	</TileMatrix>
	<TileMatrix>
		<tmsc:Identifier>16</tmsc:Identifier>
		<ScaleDenominator>4265.45916769956</ScaleDenominator>
		<CellSize>1.07288360595703E-05</CellSize>
		<PointOfOrigin>-180 90</PointOfOrigin>
		<TileWidth>256</TileWidth>
		<TileHeight>256</TileHeight>
		<MatrixWidth>131072</MatrixWidth>
		<MatrixHeight>65536</MatrixHeight>
	</TileMatrix>
	<TileMatrix>
		<tmsc:Identifier>17</tmsc:Identifier>
		<ScaleDenominator>2132.72958384978</ScaleDenominator>
		<CellSize>5.36441802978516E-06</CellSize>
		<PointOfOrigin>-180 90</PointOfOrigin>
		<TileWidth>256</TileWidth>
		<TileHeight>256</TileHeight>
		<MatrixWidth>262144</MatrixWidth>
		<MatrixHeight>131072</MatrixHeight>
	</TileMatrix>
</TileMatrixSet>
