<?xml version="1.0" encoding="UTF-8"?>
<TileMatrixSet id="EuropeanETRS89_LAEAQuad" xmlns="http://www.opengis.net/tms/2.0" xmlns:tmsc="http://www.opengis.net/tms/2.0/common" xmlns:xsi="http://www.w3.org/2001/XMLSchema-instance" xsi:schemaLocation="http://www.opengis.net/tms/2.0 https://schemas.opengis.net/tms/2.0/xml/tilematrixset.xsd">
   <tmsc:Title>Lambert Azimuthal Equal Area ETRS89 for Europe</tmsc:Title>
   <tmsc:Identifier>EuropeanETRS89_LAEAQuad</tmsc:Identifier>
   <uri>http://www.opengis.net/def/tilematrixset/OGC/1.0/EuropeanETRS89_LAEAQuad</uri>
   <tmsc:CRS>
      <tmsc:URI>http://www.opengis.net/def/crs/EPSG/0/3035</tmsc:URI>
   </tmsc:CRS>
   <OrderedAxes>Y,X</OrderedAxes>
   <TileMatrix>
      <tmsc:Identifier>0</tmsc:Identifier>
      <ScaleDenominator>62779017.8571428</ScaleDenominator>
      <CellSize>17578.125</CellSize>
      <PointOfOrigin>5500000.0 2000000.0</PointOfOrigin>
      <TileWidth>256</TileWidth>
      <TileHeight>256</TileHeight>
      <MatrixWidth>1</MatrixWidth>
      <MatrixHeight>1</MatrixHeight>
   </TileMatrix>
   <TileMatrix>
      <tmsc:Identifier>1</tmsc:Identifier>
      <ScaleDenominator>31389508.9285714</ScaleDenominator>
      <CellSize>8789.0625</CellSize>
      <PointOfOrigin>5500000.0 2000000.0</PointOfOrigin>
      <TileWidth>256</TileWidth>
      <TileHeight>256</TileHeight>
      <MatrixWidth>2</MatrixWidth>
      <MatrixHeight>2</MatrixHeight>
   </TileMatrix>
   <TileMatrix>
      <tmsc:Identifier>2</tmsc:Identifier>
      <ScaleDenominator>15694754.4642857</ScaleDenominator>
      <CellSize>4394.53125</CellSize>
      <PointOfOrigin>5500000.0 2000000.0</PointOfOrigin>
      <TileWidth>256</TileWidth>
      <TileHeight>256</TileHeight>
      <MatrixWidth>4</MatrixWidth>
      <MatrixHeight>4</MatrixHeight>
   </TileMatrix>
   <TileMatrix>
      <tmsc:Identifier>3</tmsc:Identifier>
      <ScaleDenominator>7847377.23214285</ScaleDenominator>
      <CellSize>2197.265625</CellSize>
      <PointOfOrigin>5500000.0 2000000.0</PointOfOrigin>
      <TileWidth>256</TileWidth>
      <TileHeight>256</TileHeight>
      <MatrixWidth>8</MatrixWidth>
      <MatrixHeight>8</MatrixHeight>
   </TileMatrix>
   <TileMatrix>
      <tmsc:Identifier>4</tmsc:Identifier>
      <ScaleDenominator>3923688.61607142</ScaleDenominator>
      <CellSize>1098.6328125</CellSize>
      <PointOfOrigin>5500000.0 2000000.0</PointOfOrigin>
      <TileWidth>256</TileWidth>
      <TileHeight>256</TileHeight>
      <MatrixWidth>16</MatrixWidth>
      <MatrixHeight>16</MatrixHeight>
   </TileMatrix>
   <TileMatrix>
      <tmsc:Identifier>5</tmsc:Identifier>
      <ScaleDenominator>1961844.30803571</ScaleDenominator>
      <CellSize>549.31640625</CellSize>
      <PointOfOrigin>5500000.0 2000000.0</PointOfOrigin>
      <TileWidth>256</TileWidth>
      <TileHeight>256</TileHeight>
      <MatrixWidth>32</MatrixWidth>
      <MatrixHeight>32</MatrixHeight>
   </TileMatrix>
   <TileMatrix>
      <tmsc:Identifier>6</tmsc:Identifier>
      <ScaleDenominator>980922.154017857</ScaleDenominator>
      <CellSize>274.658203125</CellSize>
      <PointOfOrigin>5500000.0 2000000.0</PointOfOrigin>
      <TileWidth>256</TileWidth>
      <TileHeight>256</TileHeight>
      <MatrixWidth>64</MatrixWidth>
      <MatrixHeight>64</MatrixHeight>
   </TileMatrix>
   <TileMatrix>
      <tmsc:Identifier>7</tmsc:Identifier>
      <ScaleDenominator>490461.077008928</ScaleDenominator>
      <CellSize>137.3291015625</CellSize>
      <PointOfOrigin>5500000.0 2000000.0</PointOfOrigin>
      <TileWidth>256</TileWidth>
      <TileHeight>256</TileHeight>
      <MatrixWidth>128</MatrixWidth>
      <MatrixHeight>128</MatrixHeight>
   </TileMatrix>
   <TileMatrix>
      <tmsc:Identifier>8</tmsc:Identifier>
      <ScaleDenominator>245230.538504464</ScaleDenominator>
      <CellSize>68.6645507812</CellSize>
      <PointOfOrigin>5500000.0 2000000.0</PointOfOrigin>
      <TileWidth>256</TileWidth>
      <TileHeight>256</TileHeight>
      <MatrixWidth>256</MatrixWidth>
      <MatrixHeight>256</MatrixHeight>
   </TileMatrix>
   <TileMatrix>
      <tmsc:Identifier>9</tmsc:Identifier>
      <ScaleDenominator>122615.269252232</ScaleDenominator>
      <CellSize>34.3322753906</CellSize>
      <PointOfOrigin>5500000.0 2000000.0</PointOfOrigin>
      <TileWidth>256</TileWidth>
      <TileHeight>256</TileHeight>
      <MatrixWidth>512</MatrixWidth>
      <MatrixHeight>512</MatrixHeight>
   </TileMatrix>
   <TileMatrix>
      <tmsc:Identifier>10</tmsc:Identifier>
      <ScaleDenominator>61307.634626116</ScaleDenominator>
      <CellSize>17.1661376953</CellSize>
      <PointOfOrigin>5500000.0 2000000.0</PointOfOrigin>
      <TileWidth>256</TileWidth>
      <TileHeight>256</TileHeight>
      <MatrixWidth>1024</MatrixWidth>
      <MatrixHeight>1024</MatrixHeight>
   </TileMatrix>
   <TileMatrix>
      <tmsc:Identifier>11</tmsc:Identifier>
      <ScaleDenominator>30653.817313058</ScaleDenominator>
      <CellSize>8.5830688477</CellSize>
      <PointOfOrigin>5500000.0 2000000.0</PointOfOrigin>
      <TileWidth>256</TileWidth>
      <TileHeight>256</TileHeight>
      <MatrixWidth>2048</MatrixWidth>
      <MatrixHeight>2048</MatrixHeight>
   </TileMatrix>
   <TileMatrix>
      <tmsc:Identifier>12</tmsc:Identifier>
      <ScaleDenominator>15326.908656529</ScaleDenominator>
      <CellSize>4.2915344238</CellSize>
      <PointOfOrigin>5500000.0 2000000.0</PointOfOrigin>
      <TileWidth>256</TileWidth>
      <TileHeight>256</TileHeight>
      <MatrixWidth>4096</MatrixWidth>
      <MatrixHeight>4096</MatrixHeight>
   </TileMatrix>
   <TileMatrix>
      <tmsc:Identifier>13</tmsc:Identifier>
      <ScaleDenominator>7663.45432826451</ScaleDenominator>
      <CellSize>2.1457672119</CellSize>
      <PointOfOrigin>5500000.0 2000000.0</PointOfOrigin>
      <TileWidth>256</TileWidth>
      <TileHeight>256</TileHeight>
      <MatrixWidth>8192</MatrixWidth>
      <MatrixHeight>8192</MatrixHeight>
   </TileMatrix>
   <TileMatrix>
      <tmsc:Identifier>14</tmsc:Identifier>
      <ScaleDenominator>3831.72716413225</ScaleDenominator>
      <CellSize>1.072883606</CellSize>
      <PointOfOrigin>5500000.0 2000000.0</PointOfOrigin>
      <TileWidth>256</TileWidth>
      <TileHeight>256</TileHeight>
      <MatrixWidth>16384</MatrixWidth>
      <MatrixHeight>16384</MatrixHeight>
   </TileMatrix>
   <TileMatrix>
      <tmsc:Identifier>15</tmsc:Identifier>
      <ScaleDenominator>1915.86358206612</ScaleDenominator>
      <CellSize>0.536441803</CellSize>
      <PointOfOrigin>5500000.0 2000000.0</PointOfOrigin>
      <TileWidth>256</TileWidth>
      <TileHeight>256</TileHeight>
      <MatrixWidth>32768</MatrixWidth>
      <MatrixHeight>32768</MatrixHeight>
   </TileMatrix>
</TileMatrixSet>
